{
  "formatVersion": 1,
  "runId": "11111111-1111-4111-8111-111111111111",
  "createdAt": "2026-10-09T13:41:53.9441815+00:00",
  "files": [
    {
      "path": "run-11111111-1111-4111-8111-111111111111.csv",
      "sha256": "da21917f3a742107197023860fd11868b9e3f5c01cc331cf8c4173af4bc0b346"
    },
    {
      "path": "run-11111111-1111-4111-8111-111111111111.txt",
      "sha256": "d02174ce790fd15c6ffa389bd1d63fbfa40ba68ee07f442631b31fe7c0858ff0"
    },
    {
      "path": "run-11111111-1111-4111-8111-111111111111.json",
      "sha256": "fc722f56116ed4b624a82a82281ec5fc887ecf4d6c1c0e6e4859b477b77ab5a3"
    }
  ]
}